<?xml version="1.0" encoding="UTF-8"?>
<!-- <!DOCTYPE form SYSTEM "form_def.dtd"> -->

<form>
	<id />
	<version>1</version>
	<name>Formulario de prueba</name>
	<author>
		<user>turawet</user>
	</author>
	<sections>
		<section>
			<name>Primera secci√≥n</name>
			<fields>
				<field>
					<id>1</id>
					<label>Etiqueta1</label>
					<type>TEXT</type>
					<required />
					<properties>
						<property>
							<name>max_length</name>
							<value>10</value>
						</property>
					</properties>
				</field>
				<field>
					<id>2</id>
					<label>Fecha1</label>
					<type>DATE</type>
					<required />
					<properties>
						<property>
							<name>format</name>
							<value>YYYY/MM/DD</value>
						</property>
						<property>
							<name>calendar</name>
							<value>MONTH_CALENDAR</value>
						</property>
					</properties>
				</field>
				<field>
					<id>1</id>
					<label>Campito</label>
					<type>TEXT</type>
					<required />
					<properties>
						<property>
							<name>max_length</name>
							<value>120</value>
						</property>
					</properties>
				</field>

				<field>
					<id>2</id>
					<label>Otra fecha</label>
					<type>DATE</type>
					<required />
					<properties>
						<property>
							<name>format</name>
							<value>DD/MM/YYYY</value>
						</property>
						<property>
							<name>calendar</name>
							<value>YEAR_CALENDAR</value>
						</property>
					</properties>
				</field>

			</fields>
		</section>
	</sections>
</form>
