<?xml version='1.0' encoding='UTF-8'?><!-- <!DOCTYPE form SYSTEM 'form_def.dtd'> --><form><meta><id /><version>1</version><name>Formulario de prueba</name><author><user>turawet</user></author></meta><sections><section><id /><name>Primera secci√≥n</name><fields><field><id>1</id><label>Etiqueta1</label><type>TEXT</type><required /><properties><property><name>max_length</name><value>10</value></property></properties></field><field><id>3</id><label>Campito</label><type>TEXT</type><required /><properties><property><name>max_length</name><value>120</value></property></properties></field><field><id>1</id><label>Etiqueta1</label><type>TEXT</type><required /><properties><property><name>max_length</name><value>10</value></property></properties></field><field><id>3</id><label>Campito</label><type>TEXT</type><required /><properties><property><name>max_length</name><value>120</value></property></properties></field><field><id>1</id><label>Etiqueta1</label><type>TEXT</type><required /><properties><property><name>max_length</name><value>10</value></property></properties></field><field><id>3</id><label>Campito</label><type>TEXT</type><required /><properties><property><name>max_length</name><value>120</value></property></properties></field><field><id>1</id><label>Etiqueta1</label><type>TEXT</type><required /><properties><property><name>max_length</name><value>10</value></property></properties></field><field><id>3</id><label>Campito</label><type>TEXT</type><required /><properties><property><name>max_length</name><value>120</value></property></properties></field><field><id>1</id><label>Etiqueta1</label><type>TEXT</type><required /><properties><property><name>max_length</name><value>10</value></property></properties></field><field><id>3</id><label>Campito</label><type>TEXT</type><required /><properties><property><name>max_length</name><value>120</value></property></properties></field><field><id>1</id><label>Etiqueta1</label><type>TEXT</type><required /><properties><property><name>max_length</name><value>10</value></property></properties></field><field><id>3</id><label>Campito</label><type>TEXT</type><required /><properties><property><name>max_length</name><value>120</value></property></properties></field><field><id>1</id><label>Etiqueta1</label><type>TEXT</type><required /><properties><property><name>max_length</name><value>10</value></property></properties></field><field><id>3</id><label>Campito</label><type>TEXT</type><required /><properties><property><name>max_length</name><value>120</value></property></properties></field><field><id>1</id><label>Etiqueta1</label><type>TEXT</type><required /><properties><property><name>max_length</name><value>10</value></property></properties></field><field><id>3</id><label>Campito</label><type>TEXT</type><required /><properties><property><name>max_length</name><value>120</value></property></properties></field><field><id>1</id><label>Etiqueta1</label><type>TEXT</type><required /><properties><property><name>max_length</name><value>10</value></property></properties></field><field><id>3</id><label>Campito</label><type>TEXT</type><required /><properties><property><name>max_length</name><value>120</value></property></properties></field><field><id>1</id><label>Etiqueta1</label><type>TEXT</type><required /><properties><property><name>max_length</name><value>10</value></property></properties></field><field><id>3</id><label>Campito</label><type>TEXT</type><required /><properties><property><name>max_length</name><value>120</value></property></properties></field><field><id>1</id><label>Etiqueta1</label><type>TEXT</type><required /><properties><property><name>max_length</name><value>10</value></property></properties></field><field><id>3</id><label>Campito</label><type>TEXT</type><required /><properties><property><name>max_length</name><value>120</value></property></properties></field><field><id>1</id><label>Etiqueta1</label><type>TEXT</type><required /><properties><property><name>max_length</name><value>10</value></property></properties></field><field><id>3</id><label>Campito</label><type>TEXT</type><required /><properties><property><name>max_length</name><value>120</value></property></properties></field><field><id>1</id><label>Etiqueta1</label><type>TEXT</type><required /><properties><property><name>max_length</name><value>10</value></property></properties></field><field><id>3</id><label>Campito</label><type>TEXT</type><required /><properties><property><name>max_length</name><value>120</value></property></properties></field><field><id>1</id><label>Etiqueta1</label><type>TEXT</type><required /><properties><property><name>max_length</name><value>10</value></property></properties></field><field><id>3</id><label>Campito</label><type>TEXT</type><required /><properties><property><name>max_length</name><value>120</value></property></properties></field><field><id>1</id><label>Etiqueta1</label><type>TEXT</type><required /><properties><property><name>max_length</name><value>10</value></property></properties></field><field><id>3</id><label>Campito</label><type>TEXT</type><required /><properties><property><name>max_length</name><value>120</value></property></properties></field><field><id>1</id><label>Etiqueta1</label><type>TEXT</type><required /><properties><property><name>max_length</name><value>10</value></property></properties></field><field><id>3</id><label>Campito</label><type>TEXT</type><required /><properties><property><name>max_length</name><value>120</value></property></properties></field><field><id>1</id><label>Etiqueta1</label><type>TEXT</type><required /><properties><property><name>max_length</name><value>10</value></property></properties></field><field><id>3</id><label>Campito</label><type>TEXT</type><required /><properties><property><name>max_length</name><value>120</value></property></properties></field><field><id>1</id><label>Etiqueta1</label><type>TEXT</type><required /><properties><property><name>max_length</name><value>10</value></property></properties></field><field><id>3</id><label>Campito</label><type>TEXT</type><required /><properties><property><name>max_length</name><value>120</value></property></properties></field><field><id>1</id><label>Etiqueta1</label><type>TEXT</type><required /><properties><property><name>max_length</name><value>10</value></property></properties></field><field><id>3</id><label>Campito</label><type>TEXT</type><required /><properties><property><name>max_length</name><value>120</value></property></properties></field><field><id>1</id><label>Etiqueta1</label><type>TEXT</type><required /><properties><property><name>max_length</name><value>10</value></property></properties></field><field><id>3</id><label>Campito</label><type>TEXT</type><required /><properties><property><name>max_length</name><value>120</value></property></properties></field><field><id>1</id><label>Etiqueta1</label><type>TEXT</type><required /><properties><property><name>max_length</name><value>10</value></property></properties></field><field><id>3</id><label>Campito</label><type>TEXT</type><required /><properties><property><name>max_length</name><value>120</value></property></properties></field><field><id>1</id><label>Etiqueta1</label><type>TEXT</type><required /><properties><property><name>max_length</name><value>10</value></property></properties></field><field><id>3</id><label>Campito</label><type>TEXT</type><required /><properties><property><name>max_length</name><value>120</value></property></properties></field><field><id>1</id><label>Etiqueta1</label><type>TEXT</type><required /><properties><property><name>max_length</name><value>10</value></property></properties></field><field><id>3</id><label>Campito</label><type>TEXT</type><required /><properties><property><name>max_length</name><value>120</value></property></properties></field><field><id>1</id><label>Etiqueta1</label><type>TEXT</type><required /><properties><property><name>max_length</name><value>10</value></property></properties></field><field><id>3</id><label>Campito</label><type>TEXT</type><required /><properties><property><name>max_length</name><value>120</value></property></properties></field><field><id>1</id><label>Etiqueta1</label><type>TEXT</type><required /><properties><property><name>max_length</name><value>10</value></property></properties></field><field><id>3</id><label>Campito</label><type>TEXT</type><required /><properties><property><name>max_length</name><value>120</value></property></properties></field></fields></section></sections></form>